Date,Headlines,Links,news
"27 July, 2024","PIB fact-checks “microphone muted” claim by Mamata Banerjee, Nirmala Sitharaman says Bengal CM alloted due time at NITI Aayog meeting",https://www.opindia.com/2024/07/centre-refutes-mama-banerjees-claim-that-she-was-not-allowed-to-speak-at-niti-aayog-meeting/,"A PIB fact check today debunked Mamata Banerjee’s allegations stating that ""only the clock showed that her speaking time was over.""The central government’s fact checking body on Saturday refuted as “misleading” the claim made by West Bengal chief minster about her microphone being switched off during a meeting of the NITI Aayog in the national capital on Saturday.A PIB fact check today debunked her allegations stating that “only the clock showed that her speaking time was over.”“It is being claimed that the microphone of CM, West Bengal was switched off during the 9th Governing Council Meeting of NITI Aayog. This claim is Misleading. The clock only showed that her speaking time was over. Even the bell was not rung to mark it,” the Press Information Bureau (PIB) said in a post on X.It is being claimed that the microphone of CM, West Bengal was switched off during the 9th Governing Council Meeting of NITI Aayog#PIBFactCheck ▶️ This claim is #Misleading ▶️ The clock only showed that her speaking time was over. Even the bell was not rung to mark it pic.twitter.com/P4N3oSOhBkMeanwhile, Union Finance Minister Nirmala Sitharaman told ANI that it is “completely false” of Mamata Banerjee to claim that her microphone was switched off and claimed that every chief minister at the meeting was “allotted their due time to speak.”“CM Mamata Banerjee attended the Niti Aayog meeting. We all heard her. Every CM was given the allotted time and that was displayed on the screen which was present before every table…She said in the media that her mic was put off. That is completely false, ” Sitharaman told ANI.“Every CM was given their due time to speak…It’s unfortunate that the chief minister of West Bengal, Mamata Banerjee has claimed that her mic was switched off which is not true…She should speak the truth behind this rather than again build a narrative based on falsehood,” the Union Finance Minister said.According to the government fact check body PIB, Mamata Banerjee’s turn to speak would be only after lunch if one goes alphabetically but she was “accomodated” as the seventh speaker on an official request from the Chief Minister.“Alphabetically, CM, West Bengal turn would have come after lunch. She was accommodated as the 7th speaker on an official request of the West Bengal government as she had to return early,” PIB Fact Check explained in a subsequent tweet.Earlier today speaking to reporters, the West Bengal Chief Minister alleged “political discrimination” and said that at the NITI Aayog meeting she was not allowed to speak for more than five minutes while other chief ministers were given more time.“…I said you (central government) should not discriminate against state governments. I wanted to speak but my mic was muted. I was allowed to speak only for five minutes. People before me spoke for 10-20 minutes,” Banerjee told reporters after she stormed out of the NITI Aayog meeting today.“I was the only one from the opposition who was participating but still, I was not allowed to speak. This is insulting…,” Banerjee said as she walked out mid way from the meeting.“I have come out boycotting the NITI Aayog meeting. Chandrababu Naidu was given 20 minutes to speak, Chief Ministers of Assam, Goa, Chhattisgarh spoke for 10-12 minutes. I was stopped after just 5 minutes. This is unfair,” the Chief Minister said speaking to reporters after coming out of the meeting.Claiming that she had chosen to participate in the meeting to strengthen “cooperative federalism” Banerjee said, “There are many regional aspirations. That is why I am here, to share those aspirations. If a state is strong, the Union will be strong.”The Chief Minister said that several states, including West Bengal, were deprived in the Union Budget that was presented in Parliament this week,Asking the central government to treat states equally, Banerjee said, “Bengal has been deprived of MNREGA funds for the last three years, nothing was paid. Treat all states equally. I said that today. I am speaking on behalf of all the states which have been deprived.”Hitting out at the central government over the Budget, the Chief Minister said that the Centre does not support “cooperative federalism.”“From the Opposition side, I am here to strengthen cooperative federalism. But you are not for cooperative federalism. The Budget is totally politically biased. Why discriminate against other states?” Banerjee said.The Trinamool Congress supremo also asked the Centre to give financial powers to NITI Aayog or bring back the Planning Commission.“NITI Aayog has no financial powers, how will it work? Give it financial powers, or bring back the Planning Commission,” she said.Chief Ministers of opposition-led states including Tamil Nadu, Kerala, Himachal Pradesh, Telangana, Delhi and Punjab boycotted the NITI Aayog meeting chaired by Prime Minister Narendra Modi.On Wednesday, Chief Minister of Punjab Bhagwant Mann and Telangana Chief Minister Revanth Reddy said that their government will boycott the NITI Aayog in protest against the central government’s alleged injustice to the state in the allocation of funds in the 2024 Union Budget.(This news report is published from a syndicated feed. Except for the headline, the content has not been written or edited by OpIndia staff)Whether NDTV or 'The Wire', they never have to worry about funds. In name of saving democracy, they get money from various sources. We need your support to fight them. Please contribute whatever you can affordEnter your email address:Contact: [email protected]News and opinion website that brings you reports and narrative from a perspective often ignored or suppressed by the mainstream media of India.© OpIndia.com"
"27 July, 2024",‘Don’t know about you but I have self-respect’: Shazia Ilmi blasts Rajdeep Sardesai for defending cameramen who filmed her inappropriately,https://www.opindia.com/2024/07/shazia-ilmi-rajdeep-sardesai-debate-pervert-camerman-misbehaved-controversy/,"Shazia Ilmi had left the primetime debate of Rajdeep Sardesai half-way after he asked to cut off the mic of the BJP spokesperson. Despite this, the cameraman kept filming without her consent.On Friday (26th July), BJP spokesperson Shazia Ilmi came down heavily on Rajdeep Sardesai after the latter accused her of ‘attacking’ the cameraman of the India Today group.Ilmi had left the primetime debate of the ‘propagandist masquerading as journalist’ half-way after he asked to cut off the mic of the BJP spokesperson. Despite this, the cameraman kept filming without her consent, leading to a physical altercation.In a tweet, Shazia Ilmi stated, “Don’t you ever bring down my Fader again. Remember I have been on both the sides and know how to handle bullies like you. BTW it doesn’t behove political propagandists masquerading as journalists to sermonise.”Ma’am, @shaziailmi I respect all my guests always. If anything, I am too indulgent: the fader is lowered only to avoid cross talk and noise on the show. If you have a grouse with me or with an army general on the show, of course that’s your prerogative. And I respect that too.… https://t.co/43atjurw75 pic.twitter.com/VjfmrrGWszRajdeep Sardesai was quick to play the ‘victim card’ and accuse the BJP spokesperson of assaulting the cameraman. “I respect all my guests always. If anything, I am too indulgent: the fader is lowered only to avoid cross talk and noise on the show. If you have a grouse with me or with an army general on the show, of course that’s your prerogative. And I respect that too,” he claimed in a tweet. “But for you to chuck the Mike and abuse our video journalist and throw him out of your house is just NOT done. He was only doing his job. No excuse for bad behaviour. The rest I leave to you. Have a good weekend (the video below is from last night…” he continued.Sardesai had also shared a video of the physical altercation. Shazia Ilmi thanked the propagandist for providing video evidence and called out the ‘pervert’ cameraman for zooming on her chest. “Why on earth would I stay on your show when you humiliate me and say CUT SHAZIA’s Mike off ? Only because I asked you whether you think all the Defence Chiefs are lying. Don’t know about you but I have SELF RESPECT,” she tweeted.@sardesairajdeep@IndiaToday Thanks for providing me with the EVIDENCE which clearly shows how your camera man behaved after the show 1. Why on earth would I stay on your show when you humiliate me and say CUT SHAZIA’s Mike off ? Only because I asked you whether you think all…The BJP spokesperson detailed the problematic behaviour of the cameraman, which forced her to evict him from her house. “Your cameraman watched me struggle as I got up and continued to film me trying to remove my mike, instead of helping me with the wheelchair. Why was he still continuing to focus on MY UPPER BODY showing it up close. It was so uncomfortable for me and I felt most embarrassed,” she pointed out.“Any lady would tell you that focussing on their chest is a clear NO NO. I could see this live on screen and requested him not to film me any or switch off the camera light. The pervert cameraman continued to film me despite my obvious physical and emotional discomfort after the show was over. Why ? Why would he keep filming him in my home, my SAFE place against my WILL? And that too, AFTER the show?” Shazia Ilmi asked.“Just because you’re a famous anchor (just as much you’re a sore loser) doesn’t mean you can humiliate people who call you out and force your crews on people , beyond the brief and violate their private space. And I dare India Today to show footage of my upper body and chest again. I will take this matter up seriously as I was deeply hurt and humiliated by this behaviour,” she warned.@sardesairajdeep @IndiaToday अपनी बदतमीज़ी का प्रमाण देने के लिए शुक्रिया ! मेरा घर मेरी सफ़ेद स्पेस है!! Not Against my will! @JPNadda@anil_baluni @PratyushKanth @Shehzad_Ind @PremShuklaBJP @pradip103 @tuhins @TimesAlgebraIND @wokeflix_ @neelkantbakshi… pic.twitter.com/UFV0K9x9JGThe BJP spokesperson concluded, “I have a right to choose what I want up show on air and I object to the lens focusing on my body and not my face AFTER the show. It’s my house and I’m curious whether your wife would entertain a crew shooting her remove her mike from up close and then follow her around after show. Thanks for providing this VIDEO EVIDENCE, which clearly shows how the lecherous cameraman is continuing to film me despite me not wanting to be ON air.”Whether NDTV or 'The Wire', they never have to worry about funds. In name of saving democracy, they get money from various sources. We need your support to fight them. Please contribute whatever you can affordEnter your email address:Contact: [email protected]News and opinion website that brings you reports and narrative from a perspective often ignored or suppressed by the mainstream media of India.© OpIndia.com"
"27 July, 2024","As Bhim Army Chief Chandrashekhar Azad ‘Ravan’ pushes for private sector reservations, a look at the economic and social pitfalls of such a step",https://www.opindia.com/2024/07/bhim-army-chief-chandrashekhar-azad-private-sector-reservations/,"The bill proposes that the Central government must incentivise private sector entities to implement reservations for SCs, STs, and OBCs by giving them special concessions and facilitating lower-interest loans through nationalised banks.On Friday (26th July), Azad Samaj Party MP from Uttar Pradesh’s Nagina and Bhim Army Chief, Chandra Shekhar Azad introduced a private member bill in Lok Sabha to extend reservations for the SCs, STs, and OBCs in the private sector. The bill is titled, ‘The Reservation for the Scheduled Castes, the Scheduled Tribes and the Other Backward Classes in Private Sector Act, 2024’. आज मैने लोक सभा में 3 निम्नलिखित गैर सरकारी विधेयक पेश किए-1. निजी क्षेत्रों में अनुसूचित जातियों,अनुसूचित जनजातियों और अन्य पिछड़े वर्गों के लिये आरक्षण की व्यवस्था।2. अनुसूचित जातियों तथा अनुसूचित जनजातियों के बच्चों के लिये आवासीय स्कूल।3. देश मे सभी बालकों को उच्च एवम्… pic.twitter.com/25YDIPZ9ZwCurrently, reservations are only applicable in the public sector and there is no reservation in the private sector. The bill proposes to change this and extend reservation benefits to the SC, ST, and OBC communities in the private sector as well. The bill introduced by Bhim Army Chief Ravan seeks to extend reservations in the private sector, educational institutions, and other establishments that have no government financial interest and employ at least 20 people. The bill proposes that the Central government must incentivise private sector entities to implement reservations for SCs, STs, and OBCs by giving them special concessions and facilitating lower-interest loans through nationalised banks.It also proposes that the government should present an annual report in both houses of Parliament to highlight all actions that have been taken under the Act, in case it is passed by both houses as well as get Presidential assent. The proposed legislation also wants to make it mandatory for the Union government to frame rules to ensure the effective implementation of the Act (if passed). The bill claims to rely on support from Articles 16(4) and 16(4A) of the Constitution. Incidentally, the said article permits reservations in public sector undertakings (PSUs) and financial institutions receiving government grants.In his statement of objects and reasons, the Bhim Army Chief claimed that to ensure equitable growth and socio-economic upliftment, it is imperative to have representation from all sections of the society while highlighting the importance of the private sector in nation-building. Any Member of Parliament (MP) can also introduce proposed legislation in both houses of Parliament and it is known as the Private Members’ Bill. Just like any other bill proposed by the government, a Private Member bill, to become an act, must be passed by both houses and receive Presidential assent. Notably, such bills can only be introduced and discussed on Fridays. Yesterday (on 26th July), as many as 31 private members’ Bills were introduced in the Lok Sabha. Congress MP Shashi Tharoor also moved a private member bill seeking to reserve 10 seats in the Lok Sabha for those below 35 years of age.Today, I introduced three Private member’s bills in the Lok Sabha. One of them would reserve 10 seats in Parliament for people under the age of 35. We already hold the world record for the biggest gap between the average age of the population and the average age of Parliament. It… pic.twitter.com/T43PFDxkHTNonetheless, it is pertinent to note that while Bhim Army Chief Chandrashekhar Azad has proposed to extend reservations for SCs, STs, and OBCs in the private sector, the Congress government in Karnataka recently proposed to extend reservations in the private sector for Kannadigas. Strikingly, the Cabinet led by Chief Minister Siddaramaiah had decided to present seven bills, including 100% reservation for Kannadigas in Category C and D jobs in all private industries in the state. However, the legislation extending reservations in the private sector for Kannadigas triggered massive opposition from top Industry leaders and within the state government, forcing the state government to halt the proposed legislation for want of ‘further discussions’.Extending reservations, either for locals or the backward communities, in the private sector could have long-term and far-reaching consequences for the economy as well as the social fabric of the country. The proposed legislation would have a chilling effect on meritocracy, ease of doing business, and investment opportunities, as well as could lead to social unrest.As a well-established fact, India, or any other country plagued by Licence or quota raj, witnessed sluggish growth for several decades but it has grown leaps and bounds after the economic reforms in 1991 which liberalised the economy and unshackled private sector from needless legislative compliance. At a time when companies are opting out of China and relocating to countries that have skilled labour, stifling meritocracy for vote bank politics, and pushing reservations in the private sector would be catastrophic. This would not only be dragging India back in this highly competitive race of ‘free’ and open market access for new companies, it would be undoing the progress in economic and other key parameters of Human development post the liberalisation era. The strength of the private sector lies in the easy and flexible accessibility of factors of production, including skilled human resources. Barring the CSR aspect, the private sector links its outcomes with high standards of performance audits. However, with reservations in the private sector and elections always around the corner, companies would face mounting pressure from the ruling party in their state of operation to not fire employees despite audit reviews, as well as to improve recruitment from the communities forming political vote bank, thus putting a constraint on their say on Human resources.This has the potential to limit the functionality of companies causing them to find an exit route to ensure their profit margin and escape the wrath of the government’s and administration’s restrictive measures like the job quota compliance. The government/police intervention in the day-to-day functioning of the company’s operation to ensure compliance would render the companies prone to “corruption”, and “bureaucratic red-tapism”, and send the state/country back to the “License quota raj” period, pre-reform era.Furthermore, rather than striving to build an egalitarian society and uplift marginalised society, the bill’s introduction could lead to social unrest, like the protests during the Mandal era when reservations were made applicable only in the public sector which makes up roughly around 2% of the total workforce. Whether NDTV or 'The Wire', they never have to worry about funds. In name of saving democracy, they get money from various sources. We need your support to fight them. Please contribute whatever you can affordEnter your email address:Contact: [email protected]News and opinion website that brings you reports and narrative from a perspective often ignored or suppressed by the mainstream media of India.© OpIndia.com"
"26 July, 2024","‘Tum Kota ke ho b***c***, Kota mein rehna hai ke nahi rehna’: Rajasthan Congress MLA Shanti Dhariwal threatens Speaker with abusive language in assembly",https://www.opindia.com/2024/07/rajasthan-congress-mla-shanti-dhariwal-abuses-speaker-in-assembly/,"The senior Rajasthan Congress leader repeatedly uttered offensive remarks during the discussion in the state assembly.On 26th July, Congress leader and North Kota MLA Shanti Kumar Dhariwal caused a stir during the Rajasthan Legislative Assembly’s question hour on the budget session when she used foul language to address Speaker Sandeep Sharma. The video of the shocking incident went viral on social media in which the latter can be heard asking the senior Congress leader to conclude as he exceeded the allotted time.Sharma requested, “Sixty-five people are scheduled to speak today. You have already spoken for 30 minutes,” to which he replied, “That doesn’t matter. Let the session continue till late.” Dhariwal then added, “Tum Kota ke ho b***c***. Kota mein rehna hai ke nahi rehna? (You are from Kota. Do you want to keep living in Kota or not),” as other members of the house laughed. Notably, Sharma is an MLA from South Kota.Arre tum Kota ke ho b#%* Kota me rehna hai ke nai tumhe: Congress MLA Shanti Dhariwal. pic.twitter.com/YuX7Tl173xShanti Dhariwal repeatedly used derogatory language in the legislative assembly. He made objectionable remarks in response to charges of wrongdoing during the Congress government and while talking on the issue of fake leases. When Bharatiya Janata Party (BJP) MLA from Nimbahera constituency Srichand Kripalani objected to his offensive utterances, he retorted, “Kripalani ji, You are my friend. Once you became a minister by mistake, you did not get the information. Now, listen to what I am saying and expand your knowledge.” BJP National Spokesperson Pratyush Kanth took to X (formerly Twitter) to slam the veteran Congressman and wrote, “This is senior Congress leader of Rajasthan, Shanti Dhariwal. He is threatening ‘Whether you want to stay in Kota or not, I will see,’ in the assembly. This is the honour of Congress for the post of Speaker which is a constitutional position. Their leaders in Delhi pretend to protect the Constitution. Will the Congress party take any action against him or will Jairam Ramesh only distance (party) from Dhariwal’s comment?”ये कांग्रेस राजस्थान के वरिष्ठ नेता शांति धारीवाल है।विधानसभा में धमकी दे रहे हैं कि आपको कोटा में रहना है या नहीं देख लेंगे।स्पीकर पद के लिए कांग्रेस का यह सम्मान जो की एक संवैधानिक पद है। दिल्ली में इनके नेता संविधान की रक्षा का ढोंग करते है।कांग्रेस पार्टी क्या इन पर कोई… pic.twitter.com/5d0Gni31WHShati Dhariwal has already drawn public ire for making a mockery of rape when he was serving as a cabinet minister in Ashok Gehlot’s administration in 2022. “Rajasthan has always been a region of manly persons. There is no doubt in the fact that we are at number one in rape cases. Why are we ahead in rape cases? Is there some fault within us? What can we do? Rajasthan has always been the state of ‘mards’ (men),” he expressed in the legislative assembly as other members received the vile remarks with laughs.The National Commission of Women (NCW) Chairperson, Rekha Sharma, had declared that the minister would face severe consequences. She stated, “Rajasthan Government has ministers like these that’s why women of the state are suffering gruesome gender crimes and police just don’t do anything. How will women of the state feel safe if it has ministers like these? NCW is taking strong action against Mr Dhariwal.”Whether NDTV or 'The Wire', they never have to worry about funds. In name of saving democracy, they get money from various sources. We need your support to fight them. Please contribute whatever you can affordEnter your email address:Contact: [email protected]News and opinion website that brings you reports and narrative from a perspective often ignored or suppressed by the mainstream media of India.© OpIndia.com"
